<?xml version="1.0" encoding="UTF-8"?>
<library xmlns:xsi="http://www.w3.org/2001/XMLSchema-instance" xsi:noNamespaceSchemaLocation="Libraries.xsd" name="General">
  <comment />
  <symbol>
    <name>G1 Additional Applications</name>
    <comment />
    <image>G1_Additional_Applications.gif</image>
    <type>static</type>
  </symbol>
  <symbol>
    <name>G10 Continue</name>
    <comment />
    <image>G10_Continue.gif</image>
    <type>static</type>
  </symbol>
  <symbol>
    <name>G11S Control Panel Generic</name>
    <comment />
    <image>G11S_Control_Panel_Generic.gif</image>
    <type>static</type>
  </symbol>
  <symbol>
    <name>G12S Control Zone Reference Information Forwarded</name>
    <comment />
    <image>G12S_Control_Zone_Reference_Information_Forwarded.gif</image>
    <type>static</type>
  </symbol>
  <symbol>
    <name>G13 Details</name>
    <comment />
    <image>G13_Details.gif</image>
    <type>static</type>
  </symbol>
  <symbol>
    <name>G14 Failure Status</name>
    <comment />
    <image>G14_Failure_Status.gif</image>
    <type>static</type>
  </symbol>
  <symbol>
    <name>G15S Fire Hole</name>
    <comment />
    <image>G15S_Fire_Hole.svg</image>
    <type>static</type>
  </symbol>
  <symbol>
    <name>G16 Freezer</name>
    <comment />
    <image>G16_Freezer.gif</image>
    <type>static</type>
  </symbol>
  <symbol>
    <name>G17S Galley Food Warmer</name>
    <comment />
    <image>G17S_Galley_Food_Warmer.gif</image>
    <type>static</type>
  </symbol>
  <symbol>
    <name>G18 Gauge</name>
    <comment />
    <image>G18_Gauge.gif</image>
    <type>static</type>
  </symbol>
  <symbol>
    <name>G19 Help</name>
    <comment />
    <image>G19_Help.gif</image>
    <type>static</type>
  </symbol>
  <symbol>
    <name>G2 Attention Symbol</name>
    <comment />
    <image>G2_Attention_Symbol.gif</image>
    <type>static</type>
  </symbol>
  <symbol>
    <name>G20 Information</name>
    <comment />
    <image>G20_Information.gif</image>
    <type>static</type>
  </symbol>
  <symbol>
    <name>G21 Log</name>
    <comment />
    <image>G21_Log.gif</image>
    <type>static</type>
  </symbol>
  <symbol>
    <name>G22 Meter Panel Analog</name>
    <comment />
    <image>G22_Meter_Panel_Analog.gif</image>
    <type>static</type>
  </symbol>
  <symbol>
    <name>G23 Mode</name>
    <comment />
    <image>G23_Mode.gif</image>
    <type>static</type>
  </symbol>
  <symbol>
    <name>G24 More Details</name>
    <comment />
    <image>G24_More_Details.gif</image>
    <type>static</type>
  </symbol>
  <symbol>
    <name>G25 Open</name>
    <comment />
    <image>G25_Open.gif</image>
    <type>static</type>
  </symbol>
  <symbol>
    <name>G26 Permission</name>
    <comment />
    <image>G26_Permission.gif</image>
    <type>static</type>
  </symbol>
  <symbol>
    <name>G27 Readiness</name>
    <comment />
    <image>G27_Readiness.gif</image>
    <type>static</type>
  </symbol>
  <symbol>
    <name>G28 Refrigerator</name>
    <comment />
    <image>G28_Refrigerator.gif</image>
    <type>static</type>
  </symbol>
  <symbol>
    <name>G28S Refrigerator</name>
    <comment />
    <image>G28S_Refrigerator.gif</image>
    <type>static</type>
  </symbol>
  <symbol>
    <name>G29S Remote Power Controller RPC</name>
    <comment />
    <image>G29S_Remote_Power_Controller_RPC.gif</image>
    <type>static</type>
  </symbol>
  <symbol>
    <name>G3 Bar Graph Horizontal</name>
    <comment />
    <image>G3_Bar_Graph_Horizontal.gif</image>
    <type>static</type>
  </symbol>
  <symbol>
    <name>G3 Bar Graph Vertical</name>
    <comment />
    <image>G3_Bar_Graph_Vertical.gif</image>
    <type>static</type>
  </symbol>
  <symbol>
    <name>G30S Remote Power Controller Mechanism RPCM</name>
    <comment />
    <image>G30S_Remote_Power_Controller_Mechanism_RPCM.gif</image>
    <type>static</type>
  </symbol>
  <symbol>
    <name>G32 Save</name>
    <comment />
    <image>G32_Save.gif</image>
    <type>static</type>
  </symbol>
  <symbol>
    <name>G33S Telemetry Diamond</name>
    <comment />
    <image>G33S_Telemetry_Diamond.gif</image>
    <type>static</type>
  </symbol>
  <symbol>
    <name>G34S Time Delay</name>
    <comment />
    <image>G34S_Time_Delay.gif</image>
    <type>static</type>
  </symbol>
  <symbol>
    <name>G35 Timer Animated</name>
    <comment />
    <image>G35_Timer_Animated.gif</image>
    <type>static</type>
  </symbol>
  <symbol>
    <name>G36 Timer External Process</name>
    <comment />
    <image>G36_Timer_External_Process.gif</image>
    <type>static</type>
  </symbol>
  <symbol>
    <name>G37 Timer Local Process</name>
    <comment />
    <image>G37_Timer_Local_Process.gif</image>
    <type>static</type>
  </symbol>
  <symbol>
    <name>G38S Voting</name>
    <comment />
    <image>G38S_Voting.gif</image>
    <type>static</type>
  </symbol>
  <symbol>
    <name>G40 Exit</name>
    <comment />
    <image>G40_Exit.gif</image>
    <type>static</type>
  </symbol>
  <symbol>
    <name>G4S Bubble Bit Bite</name>
    <comment />
    <image>G4S_Bubble_Bit_Bite.gif</image>
    <type>static</type>
  </symbol>
  <symbol>
    <name>G5S Bubble Command</name>
    <comment />
    <image>G5S_Bubble_Command.gif</image>
    <type>static</type>
  </symbol>
  <symbol>
    <name>G6S Bubble Telemetry</name>
    <comment />
    <image>G6S_Bubble_Telemetry.gif</image>
    <type>static</type>
  </symbol>
  <symbol>
    <name>G7S Bus Reference</name>
    <comment />
    <image>G7S_Bus_Reference.gif</image>
    <type>static</type>
  </symbol>
  <symbol>
    <name>G8 Center Point</name>
    <comment />
    <image>G8_Center_Point.gif</image>
    <type>static</type>
  </symbol>
  <symbol>
    <name>G9S Command Time Out</name>
    <comment />
    <image>G9S_Command_Time_Out.gif</image>
    <type>static</type>
  </symbol>
  <symbol>
    <name>P-G1 Cow Shed</name>
    <comment />
    <image>P-G1_Cow_Shed.gif</image>
    <type>static</type>
  </symbol>
  <symbol>
    <name>P-G2 Menu</name>
    <comment />
    <image>P-G2_Menu.gif</image>
    <type>static</type>
  </symbol>
  <symbol>
    <name>P-G3 No</name>
    <comment />
    <image>P-G3_No.gif</image>
    <type>static</type>
  </symbol>
  <symbol>
    <name>P-G4 Resize Decrease</name>
    <comment />
    <image>P-G4_Resize_Decrease.gif</image>
    <type>static</type>
  </symbol>
  <symbol>
    <name>P-G4 Resize Increase</name>
    <comment />
    <image>P-G4_Resize_Increase.gif</image>
    <type>static</type>
  </symbol>
</library>

