<?xml version="1.0" encoding="UTF-8"?>
<library xmlns:xsi="http://www.w3.org/2001/XMLSchema-instance" xsi:noNamespaceSchemaLocation="Libraries.xsd" name="Logic">
  <comment />
  <symbol>
    <name>L1S Gate AND</name>
    <comment />
    <image>L1S_Gate_AND.gif</image>
    <type>static</type>
  </symbol>
  <symbol>
    <name>L2S Gate Exclusive OR</name>
    <comment />
    <image>L2S_Gate_Exclusive_OR.gif</image>
    <type>static</type>
  </symbol>
  <symbol>
    <name>L3S Gate NAND</name>
    <comment />
    <image>L3S_Gate_NAND.gif</image>
    <type>static</type>
  </symbol>
  <symbol>
    <name>L4S Gate NOR</name>
    <comment />
    <image>L4S_Gate_NOR.gif</image>
    <type>static</type>
  </symbol>
  <symbol>
    <name>L5S Gate OR</name>
    <comment />
    <image>L5S_Gate_OR.gif</image>
    <type>static</type>
  </symbol>
</library>

