<?xml version="1.0" encoding="UTF-8"?>
<library xmlns:xsi="http://www.w3.org/2001/XMLSchema-instance" xsi:noNamespaceSchemaLocation="Libraries.xsd" name="Events">
  <comment />
  <symbol>
    <name>EV1 Acquisition and Loss of Signal</name>
    <comment />
    <image>EV1_Acquisition_and_Loss_of_Signal.gif</image>
    <type>static</type>
  </symbol>
  <symbol>
    <name>EV10 Switch English Russian</name>
    <comment />
    <image>EV10_Switch_English_Russian.gif</image>
    <type>static</type>
  </symbol>
  <symbol>
    <name>EV10 Switch Russian English</name>
    <comment />
    <image>EV10_Switch_Russian_English.gif</image>
    <type>static</type>
  </symbol>
  <symbol>
    <name>EV11 Light Shade Daylight Dark Trans Symbol Active Day</name>
    <comment />
    <image>EV11_Light_Shade_Daylight_Dark_Trans_Symbol_Active_Day.gif</image>
    <type>static</type>
  </symbol>
  <symbol>
    <name>EV11 Light Shade Daylight Dark Trans Symbol Active Night</name>
    <comment />
    <image>EV11_Light_Shade_Daylight_Dark_Trans_Symbol_Active_Night.gif</image>
    <type>static</type>
  </symbol>
  <symbol>
    <name>EV12 Navigation List</name>
    <comment />
    <image>EV12_Navigation_List.gif</image>
    <type>static</type>
  </symbol>
  <symbol>
    <name>EV13 Navigation Tree</name>
    <comment />
    <image>EV13_Navigation_Tree.gif</image>
    <type>static</type>
  </symbol>
  <symbol>
    <name>EV2 Advisory</name>
    <comment />
    <image>EV2_Advisory.gif</image>
    <type>static</type>
  </symbol>
  <symbol>
    <name>EV3 Atmospheric Contamination</name>
    <comment />
    <image>EV3_Atmospheric_Contamination.gif</image>
    <type>static</type>
  </symbol>
  <symbol>
    <name>EV4 Caution</name>
    <comment />
    <image>EV4_Caution.gif</image>
    <type>static</type>
  </symbol>
  <symbol>
    <name>EV4 Warning</name>
    <comment />
    <image>EV4_Warning.gif</image>
    <type>static</type>
  </symbol>
  <symbol>
    <name>EV5 Delta Pressure Delta Temperature (dPdT) Decompression</name>
    <comment />
    <image>EV5_Delta_Pressure_Delta_Temperature_%28dPdT%29_Decompression.gif</image>
    <type>static</type>
  </symbol>
  <symbol>
    <name>EV6 Events Details</name>
    <comment />
    <image>EV6_Events_Details.gif</image>
    <type>static</type>
  </symbol>
  <symbol>
    <name>EV7 Fire</name>
    <comment />
    <image>EV7_Fire.gif</image>
    <type>static</type>
  </symbol>
  <symbol>
    <name>EV8 Home</name>
    <comment />
    <image>EV8_Home.svg</image>
    <type>static</type>
  </symbol>
  <symbol>
    <name>EV9 Hot Key Mapping ESA</name>
    <comment />
    <image>EV9_Hot_Key_Mapping_ESA.gif</image>
    <type>static</type>
  </symbol>
  <symbol>
    <name>EV9 Hot Key Mapping JAXA</name>
    <comment />
    <image>EV9_Hot_Key_Mapping_JAXA.gif</image>
    <type>static</type>
  </symbol>
  <symbol>
    <name>EV9 Hot Key Mapping NASA</name>
    <comment />
    <image>EV9_Hot_Key_Mapping_NASA.gif</image>
    <type>static</type>
  </symbol>
  <symbol>
    <name>EV9 Hot Key Mapping RASA</name>
    <comment />
    <image>EV9_Hot_Key_Mapping_RASA.gif</image>
    <type>static</type>
  </symbol>
</library>

