<?xml version="1.0" encoding="UTF-8"?>
<library xmlns:xsi="http://www.w3.org/2001/XMLSchema-instance" xsi:noNamespaceSchemaLocation="Libraries.xsd" name="Tasks">
  <comment />
  <symbol>
    <name>T1 Attitude</name>
    <comment />
    <image>T1_Attitude.gif</image>
    <type>static</type>
  </symbol>
  <symbol>
    <name>T2 Attitude Reboost</name>
    <comment />
    <image>T2_Attitude_Reboost.gif</image>
    <type>static</type>
  </symbol>
  <symbol>
    <name>T3 Docking</name>
    <comment />
    <image>T3_Docking.gif</image>
    <type>static</type>
  </symbol>
  <symbol>
    <name>T4 Liquid gas transfer C</name>
    <comment />
    <image>T4_Liquid_gas_transfer_C.gif</image>
    <type>static</type>
  </symbol>
  <symbol>
    <name>T5 Undocking</name>
    <comment />
    <image>T5_Undocking.gif</image>
    <type>static</type>
  </symbol>
</library>

