<?xml version="1.0" encoding="UTF-8"?>
<library xmlns:xsi="http://www.w3.org/2001/XMLSchema-instance" xsi:noNamespaceSchemaLocation="Libraries.xsd" name="Modes">
  <comment />
  <symbol>
    <name>MO1 Crew Rescue Mode</name>
    <comment />
    <image>MO1_Crew_Rescue_Mode.svg</image>
    <type>static</type>
  </symbol>
  <symbol>
    <name>MO10 Survival Mode</name>
    <comment />
    <image>MO10_Survival_Mode.svg</image>
    <type>static</type>
  </symbol>
  <symbol>
    <name>MO2 Extravehicular Activity EVA</name>
    <comment />
    <image>MO2_Extravehicular_Activity_EVA.gif</image>
    <type>static</type>
  </symbol>
  <symbol>
    <name>MO2 Extravehicular Activtiy EVA</name>
    <comment />
    <image>MO2_Extravehicular_Activtiy_EVA.svg</image>
    <type>static</type>
  </symbol>
  <symbol>
    <name>MO3 Gyrodyne Spin Up</name>
    <comment />
    <image>MO3_Gyrodyne_Spin_Up.svg</image>
    <type>static</type>
  </symbol>
  <symbol>
    <name>MO4 Initial Attitude</name>
    <comment />
    <image>MO4_Initial_Attitude.svg</image>
    <type>static</type>
  </symbol>
  <symbol>
    <name>MO5 Microgravity</name>
    <comment />
    <image>MO5_Microgravity.svg</image>
    <type>static</type>
  </symbol>
  <symbol>
    <name>MO6 Proximity Operations Docking Target</name>
    <comment />
    <image>MO6_Proximity_Operations_Docking_Target.svg</image>
    <type>static</type>
  </symbol>
  <symbol>
    <name>MO7 Reboost</name>
    <comment />
    <image>MO7_Reboost.svg</image>
    <type>static</type>
  </symbol>
  <symbol>
    <name>MO8 Refuel</name>
    <comment />
    <image>MO8_Refuel.svg</image>
    <type>static</type>
  </symbol>
  <symbol>
    <name>MO9 Standard Nominal</name>
    <comment />
    <image>MO9_Standard_Nominal.svg</image>
    <type>static</type>
  </symbol>
</library>

