<?xml version="1.0" encoding="UTF-8"?>
<library xmlns:xsi="http://www.w3.org/2001/XMLSchema-instance" xsi:noNamespaceSchemaLocation="Libraries.xsd" name="Computers">
  <comment />
  <symbol>
    <name>K1 Bus Coupler</name>
    <comment />
    <image>K1_Bus_Coupler.gif</image>
    <type>static</type>
  </symbol>
  <symbol>
    <name>K10S Mouse Pointing Device</name>
    <comment />
    <image>K10S_Mouse_Pointing_Device.gif</image>
    <type>static</type>
  </symbol>
  <symbol>
    <name>K11 MDM 1 Channel</name>
    <comment />
    <image>K11_MDM_1_Channel.svg</image>
    <type>static</type>
  </symbol>
  <symbol>
    <name>K12 MDM 3 Channel</name>
    <comment />
    <image>K12_MDM_3_Channel.gif</image>
    <type>static</type>
  </symbol>
  <symbol>
    <name>K13 Network Channel Controller</name>
    <comment />
    <image>K13_Network_Channel_Controller.gif</image>
    <type>static</type>
  </symbol>
  <symbol>
    <name>K13S Network Channel Controller</name>
    <comment />
    <image>K13S_Network_Channel_Controller.gif</image>
    <type>static</type>
  </symbol>
  <symbol>
    <name>K14S Output</name>
    <comment />
    <image>K14S_Output.gif</image>
    <type>static</type>
  </symbol>
  <symbol>
    <name>K15 Sampling Unit</name>
    <comment />
    <image>K15_Sampling_Unit.gif</image>
    <type>static</type>
  </symbol>
  <symbol>
    <name>K16 Switch Automated Payload</name>
    <comment />
    <image>K16_Switch_Automated_Payload.gif</image>
    <type>static</type>
  </symbol>
  <symbol>
    <name>K17 Switching Unit</name>
    <comment />
    <image>K17_Switching_Unit.gif</image>
    <type>static</type>
  </symbol>
  <symbol>
    <name>K18 Terminal Switching Unit</name>
    <comment />
    <image>K18_Terminal_Switching_Unit.gif</image>
    <type>static</type>
  </symbol>
  <symbol>
    <name>K2S Channel Selector with Logic Control</name>
    <comment />
    <image>K2S_Channel_Selector_with_Logic_Control.gif</image>
    <type>static</type>
  </symbol>
  <symbol>
    <name>K3 Computer Laptop</name>
    <comment />
    <image>K3_Computer_Laptop.gif</image>
    <type>static</type>
  </symbol>
  <symbol>
    <name>K4 Computer One Channel</name>
    <comment />
    <image>K4_Computer_One_Channel.gif</image>
    <type>static</type>
  </symbol>
  <symbol>
    <name>K5 Computer Three Channel</name>
    <comment />
    <image>K5_Computer_Three_Channel.gif</image>
    <type>static</type>
  </symbol>
  <symbol>
    <name>K6 Discrete Input Output Device</name>
    <comment />
    <image>K6_Discrete_Input_Output_Device.gif</image>
    <type>static</type>
  </symbol>
  <symbol>
    <name>K6 Discrete Input Output Signal</name>
    <comment />
    <image>K6_Discrete_Input_Output_Signal.svg</image>
    <type>static</type>
  </symbol>
  <symbol>
    <name>K7S Input</name>
    <comment />
    <image>K7S_Input.gif</image>
    <type>static</type>
  </symbol>
  <symbol>
    <name>K8S Keyboard</name>
    <comment />
    <image>K8S_Keyboard.gif</image>
    <type>static</type>
  </symbol>
  <symbol>
    <name>K9 Monitor</name>
    <comment />
    <image>K9_Monitor.svg</image>
    <type>static</type>
  </symbol>
  <symbol>
    <name>P-K1 Terminator</name>
    <comment />
    <image>P-K1_Terminator.gif</image>
    <type>static</type>
  </symbol>
</library>

