<?xml version="1.0" encoding="UTF-8"?>
<library xmlns:xsi="http://www.w3.org/2001/XMLSchema-instance" xsi:noNamespaceSchemaLocation="Libraries.xsd" name="Robotics">
  <comment />
  <symbol>
    <name>R1 Auto Sequence Switch Hot</name>
    <comment />
    <image>R1_Auto_Sequence_Switch_Hot.svg</image>
    <type>static</type>
  </symbol>
  <symbol>
    <name>R10 Special Purpose Dexterous Manipulator SPDM Body</name>
    <comment />
    <image>R10_Special_Purpose_Dexterous_Manipulator_SPDM_Body.gif</image>
    <type>static</type>
  </symbol>
  <symbol>
    <name>R2 Grapple Fixture</name>
    <comment />
    <image>R2_Grapple_Fixture.svg</image>
    <type>static</type>
  </symbol>
  <symbol>
    <name>R3 Hand Controller Rational with Roll Axis RHC</name>
    <comment />
    <image>R3_Hand_Controller_Rational_with_Roll_Axis_RHC.svg</image>
    <type>static</type>
  </symbol>
  <symbol>
    <name>R4 Hand Controller Translational Directions THC</name>
    <comment />
    <image>R4_Hand_Controller_Translational_Directions_THC.gif</image>
    <type>static</type>
  </symbol>
  <symbol>
    <name>R5 Manipulator Joint</name>
    <comment />
    <image>R5_Manipulator_Joint.svg</image>
    <type>static</type>
  </symbol>
  <symbol>
    <name>R6 Position Hold</name>
    <comment />
    <image>R6_Position_Hold.gif</image>
    <type>static</type>
  </symbol>
  <symbol>
    <name>R7 Rate Hold</name>
    <comment />
    <image>R7_Rate_Hold.gif</image>
    <type>static</type>
  </symbol>
  <symbol>
    <name>R8 Self Collision</name>
    <comment />
    <image>R8_Self_Collision.gif</image>
    <type>static</type>
  </symbol>
  <symbol>
    <name>R9 Singularity</name>
    <comment />
    <image>R9_Singularity.gif</image>
    <type>static</type>
  </symbol>
</library>

